{
  "schema_version": "1.0.0",
  "standard": "docs/ai/HARNESS_ENGINEERING_GOVERNANCE_STANDARD.md",
  "notes": "HE2 tooling seed inventory. It demonstrates every governed status class against the J1/H2 incidents and the seven required cross-cutting interactions. It deliberately does NOT claim coverage: no node carries evidence, PASS is absent, and all uncovered work is registered in coverage-debt.json. Full risk-first business backfill is authorized separately under HE3.",
  "nodes": [
    {
      "id": "AUTH-INT-001",
      "capability": "password recovery",
      "risk": "P0",
      "actor": "anonymous",
      "tenant_role": "none",
      "entry": "direct route: public reset endpoint reached while global interceptor is active",
      "session_state": "none",
      "tenant_state": "none",
      "resource_state": "absent",
      "input_state": "malformed reset payload",
      "action": "submit reset completion to public endpoint expecting a neutral 4xx",
      "response_class": "4xx",
      "ui_oracle": "neutral error copy is rendered; no account-existence signal; no session chrome appears",
      "navigation_oracle": "route stays on the public reset route; no redirect to /login or /retail/login",
      "network_oracle": "reset request returns 4xx exactly once; no token-refresh request is issued",
      "session_oracle": "auth store remains anonymous; no access or refresh token is written",
      "persistence_security_oracle": "password unchanged; reset token not consumed; no secret in response body",
      "viewport": "desktop",
      "runtime": "clean-start",
      "layer": "browser",
      "authoritative": true,
      "source_anchors": [
        "frontend/src/services/api.ts:104",
        "frontend/src/services/api.ts:179",
        "backend/api/app.py:38"
      ],
      "mutation_id": "MUT-AUTH-INT-001",
      "owner": "cto",
      "evidence_sha": "",
      "status": "NOT_RUN",
      "interaction_ids": [
        "CI-AUTH-INTERCEPTOR",
        "CI-TOKEN-REPLAY"
      ],
      "notes": "J1/H2-B incident: public reset 401 was redirected by the global session interceptor before the page could render its neutral error."
    },
    {
      "id": "AUTH-INT-002",
      "capability": "public credential workflows",
      "risk": "P0",
      "actor": "wholesaler owner",
      "tenant_role": "wholesaler workspace",
      "entry": "direct route: public endpoint invoked with skipAuthInterceptors while a stale contextual session exists",
      "session_state": "stale access",
      "tenant_state": "active",
      "resource_state": "valid",
      "input_state": "valid",
      "action": "call public credential endpoint with explicit no-auth request semantics",
      "response_class": "2xx",
      "ui_oracle": "workflow completes; stale-session banner does not appear; no forced re-login",
      "navigation_oracle": "final route is the workflow's own success route; history has no /login entry",
      "network_oracle": "public request carries no Authorization header; no refresh request is triggered by this call",
      "session_oracle": "pre-existing (stale) tokens are not silently refreshed or cleared by the public call",
      "persistence_security_oracle": "no credential rotation side effect; response contains no token material",
      "viewport": "desktop",
      "runtime": "persisted-session",
      "layer": "browser",
      "authoritative": true,
      "source_anchors": [
        "frontend/src/services/api.ts:23",
        "frontend/src/services/api.ts:119"
      ],
      "mutation_id": "MUT-AUTH-INT-002",
      "owner": "cto",
      "evidence_sha": "",
      "status": "NOT_RUN",
      "interaction_ids": [
        "CI-AUTH-INTERCEPTOR"
      ]
    },
    {
      "id": "TENANT-ISO-001",
      "capability": "tenant isolation",
      "risk": "P0",
      "actor": "wholesaler owner",
      "tenant_role": "wholesaler workspace A",
      "entry": "api endpoint: tenant-scoped read of a resource owned by workspace B",
      "session_state": "contextual",
      "tenant_state": "wrong tenant",
      "resource_state": "valid",
      "input_state": "valid",
      "action": "request another tenant's resource through the tenant search path",
      "response_class": "403",
      "ui_oracle": "NOT_APPLICABLE",
      "navigation_oracle": "NOT_APPLICABLE",
      "network_oracle": "request returns 403/404; response body contains no cross-tenant identifiers",
      "session_oracle": "session unchanged; workspace context cannot be switched by payload tampering",
      "persistence_security_oracle": "no row from another schema is readable or writable; search_path stays pinned to caller schema",
      "viewport": "desktop",
      "runtime": "fresh-database",
      "layer": "full_stack",
      "authoritative": true,
      "source_anchors": [
        "backend/api/context/tenant.py:65",
        "backend/api/context/tenant.py:73",
        "backend/db/tenant_filter.py:1"
      ],
      "mutation_id": "MUT-TENANT-ISO-001",
      "owner": "cto",
      "evidence_sha": "",
      "status": "NOT_RUN",
      "interaction_ids": [
        "CI-TENANT-ROUTING"
      ]
    },
    {
      "id": "RATE-429-001",
      "capability": "rate-limited authentication routes",
      "risk": "P1",
      "actor": "anonymous",
      "tenant_role": "none",
      "entry": "api endpoint: rate-limited route under burst",
      "session_state": "none",
      "tenant_state": "none",
      "resource_state": "absent",
      "input_state": "valid",
      "action": "exceed the anonymous rate limit on a rate-limited route",
      "response_class": "429",
      "ui_oracle": "user-visible rate-limit message; next supported action (retry after window) is available",
      "navigation_oracle": "route is stable; no redirect or history mutation on 429",
      "network_oracle": "429 response carries rate-limit headers; no further upstream requests after rejection",
      "session_oracle": "no session is created by rejected requests",
      "persistence_security_oracle": "rejected requests produce no tenant data writes; no credential material in 429 body",
      "viewport": "desktop",
      "runtime": "clean-start",
      "layer": "route_api",
      "authoritative": true,
      "source_anchors": [
        "backend/core/rate_limiter.py:60",
        "backend/api/middleware/rate_limiting.py:91"
      ],
      "mutation_id": "MUT-RATE-429-001",
      "owner": "cto",
      "evidence_sha": "",
      "status": "NOT_RUN",
      "interaction_ids": [
        "CI-RATE-LIMIT"
      ]
    },
    {
      "id": "IDEM-PAY-001",
      "capability": "payment declaration",
      "risk": "P0",
      "actor": "retailer",
      "tenant_role": "retailer workspace",
      "entry": "api endpoint: payment declaration confirm",
      "session_state": "contextual",
      "tenant_state": "active",
      "resource_state": "duplicate",
      "input_state": "replayed",
      "action": "replay the same payment declaration confirm (duplicate click and replayed request)",
      "response_class": "2xx",
      "ui_oracle": "no duplicate confirmation UI state; single declaration shown after refresh",
      "navigation_oracle": "NOT_APPLICABLE",
      "network_oracle": "replayed confirm returns the original result (same record id); no second mutation request is processed",
      "session_oracle": "session unchanged",
      "persistence_security_oracle": "exactly one declaration row and one ledger effect; same key with different payload is rejected",
      "viewport": "desktop",
      "runtime": "clean-start",
      "layer": "full_stack",
      "authoritative": true,
      "source_anchors": [
        "backend/services/payment_declaration_service.py:79",
        "backend/services/payment_declaration_service.py:132",
        "backend/services/payment_declaration_service.py:189"
      ],
      "mutation_id": "MUT-IDEM-PAY-001",
      "owner": "cto",
      "evidence_sha": "",
      "status": "NOT_RUN",
      "interaction_ids": [
        "CI-IDEMPOTENCY",
        "CI-TRANSACTION-BOUNDARY"
      ]
    },
    {
      "id": "IDEM-MW-001",
      "capability": "idempotency middleware contract",
      "risk": "P2",
      "actor": "wholesaler operator",
      "tenant_role": "wholesaler workspace",
      "entry": "api endpoint: X-Idempotency-Key protected mutation",
      "session_state": "contextual",
      "tenant_state": "active",
      "resource_state": "valid",
      "input_state": "replayed",
      "action": "retry a mutation with the same idempotency key, then with the same key but different payload",
      "response_class": "2xx/409",
      "ui_oracle": "NOT_APPLICABLE",
      "navigation_oracle": "NOT_APPLICABLE",
      "network_oracle": "same-key same-payload returns cached result; same-key different-payload returns 409-class rejection",
      "session_oracle": "session unchanged",
      "persistence_security_oracle": "replay cache entry is scoped to tenant and endpoint; no cross-tenant cache leak",
      "viewport": "desktop",
      "runtime": "clean-start",
      "layer": "route_api",
      "authoritative": false,
      "source_anchors": [
        "backend/api/middleware/idempotency.py:55"
      ],
      "mutation_id": "MUT-IDEM-MW-001",
      "owner": "cto",
      "evidence_sha": "",
      "status": "NOT_RUN",
      "interaction_ids": [
        "CI-IDEMPOTENCY"
      ]
    },
    {
      "id": "TOKEN-RST-001",
      "capability": "password recovery tokens",
      "risk": "P0",
      "actor": "wholesaler owner",
      "tenant_role": "wholesaler workspace",
      "entry": "fragment link: reset token URL",
      "session_state": "none",
      "tenant_state": "active",
      "resource_state": "used",
      "input_state": "replayed",
      "action": "consume a used reset token, then exercise expired, revoked, and forged variants",
      "response_class": "4xx",
      "ui_oracle": "neutral invalid-token copy for every invalid variant; identical copy across variants",